{
  "schema_version": "1.0",
  "measure_id": "security_authz_50",
  "construct": "use by intended callers, in the intended way",
  "estimand": "theta = P(a 50-decision window meets the authorised-use criterion)",
  "evidence_type": "system_behavior",
  "observable_fields": [
    "caller_id",
    "auth_result",
    "policy_violation"
  ],
  "window": {
    "length": 50,
    "unit": "decisions"
  },
  "measurement_function": "share of calls that authenticated and broke no policy rule",
  "parameters": {},
  "operator": ">=",
  "threshold": 0.98,
  "theta_threshold": 0.75,
  "prior": {
    "alpha": 2.0,
    "beta": 8.0,
    "mode": "illustrative"
  },
  "sufficiency": {
    "min_observations": 8,
    "max_age_days": 30
  },
  "owner": "security_lead",
  "limitations": [
    "covers use of this system, not the surrounding network",
    "an authorised caller can still be misusing the system",
    "input provenance and authorisation scope are not instrumented"
  ]
}
